{
  "status": "COMPLETED",
  "created_files": [
    "docs/md/spec.md"
  ],
  "modified_files": [],
  "deleted_files": [],
  "verified_files": [],
  "blockers": [],
  "notes": [
    "Execution report synthesized by the V5.2.2 orchestrator.",
    "Each CREATE/MODIFY target was executed in an isolated one-file Editor invocation.",
    "Unauthorized Editor writes were rolled back automatically before acceptance.",
    "DELETE operations were performed by the orchestrator.",
    "This report describes the current round; changes.patch describes the cumulative candidate from baseline."
  ]
}
